title,link,phone,address,Latitude,Longitude
All Saints (St. Peters),https://www.archstl.org/parish-directory/all-saints-st-peters,636.397.1440,"7 McMenamy Rd., St. Peters, MO 63376-1590",38.796705,-90.628541
All Saints (University City),https://www.archstl.org/parish-directory/all-saints-university-city,314.721.6403,"6403 Clemens Ave., St. Louis, MO 63130-3497",38.659258,-90.303457
All Souls (Overland),https://www.archstl.org/parish-directory/all-souls-overland,314.427.0442,"9550 Tennyson Ave., St. Louis, MO 63114-3399",38.704076,-90.36647
Annunciation (Webster Groves),https://www.archstl.org/parish-directory/annunciation-webster-groves,314.962.5955,"12 W. Glendale Rd., Webster Groves, MO 63119-4097",38.57611,-90.359319
"Annunziata, Church of the (Ladue)",https://www.archstl.org/parish-directory/annunziata-church-of-the-ladue,314.993.4422,"9305 Clayton Rd., St. Louis, MO 63124-1692",38.64161,-90.374272
Ascension (Chesterfield),https://www.archstl.org/parish-directory/ascension-chesterfield,636.532.3304,"230 Santa Maria Dr., Chesterfield, MO 63005-1600",38.661654,-90.579451
Assumption (Mattese),https://www.archstl.org/parish-directory/assumption-mattese,314.487.7970,"4725 Mattis Rd., St. Louis, MO 63128-2821",38.501019,-90.361183
Assumption (New Haven),https://www.archstl.org/parish-directory/assumption-new-haven,573.237.3372,"603 Miller St., New Haven, MO 63068-1116",38.606688,-91.217398
Assumption (O'Fallon),https://www.archstl.org/parish-directory/assumption-ofallon,636.240.3721,"403 N. Main St., O'Fallon, MO 63366-2205",38.813503,-90.700486
"Basilica of St. Louis, King of France",https://www.archstl.org/parish-directory/basilica-of-st-louis-king-of-france,314.231.3250,"209 Walnut St., St. Louis, MO 63102-2499",38.624156,-90.186988
Blessed Teresa of Calcutta (Ferguson),https://www.archstl.org/parish-directory/blessed-teresa-of-calcutta-ferguson,314.524.0500,"120 N. Elizabeth Ave, St. Louis, MO 63135-1346",38.748107,-90.298704
Cathedral Basilica of Saint Louis,https://www.archstl.org/parish-directory/cathedral-basilica-of-saint-louis,314.373.8200,"4431 Lindell Blvd., St. Louis, MO 63108-2496",38.642295,-90.254922
Christ the King (University City),https://www.archstl.org/parish-directory/christ-the-king-university-city,314.721.8737,"7316 Balson Ave., St. Louis, MO 63130-2999",38.663502,-90.325746
Christ the Savior (Brewer),https://www.archstl.org/parish-directory/christ-the-savior-brewer,573.547.4300,"57 Shady Ln., Perryville, MO 63775-7386",37.780721,-89.926465
"Christ, Prince of Peace (Manchester)",https://www.archstl.org/parish-directory/christ-prince-of-peace-manchester,636.391.1307,"415 Weidman Rd., Manchester, MO 63011-4431",38.599683,-90.494122
Cure of Ars (Shrewsbury),https://www.archstl.org/parish-directory/cur-of-ars-shrewsbury,314.962.5883,"670 S. Laclede Station Rd., St. Louis, MO 63119-4910",38.576686,-90.335976
Epiphany of Our Lord (St. Louis),https://www.archstl.org/parish-directory/epiphany-of-our-lord-st-louis,314.781.1199,"6596 Smiley Ave., St. Louis, MO 63139-2487",38.606649,-90.302476
"Good Shepherd, Church of the (Hillsboro)",https://www.archstl.org/parish-directory/good-shepherd-church-of-the-hillsboro,636.789.3356,"703 Third St., Hillsboro, MO 63050-4342",38.233726,-90.567604
Holy Family (Port Hudson),https://www.archstl.org/parish-directory/holy-family-port-hudson,573.459.6441,"124 Holy Family Church Rd., New Haven, MO 63068-2664",38.496416,-91.234522
Holy Infant (Ballwin),https://www.archstl.org/parish-directory/holy-infant-ballwin,636.227.7440,"627 Dennison Dr., Ballwin, MO 63021-4898",38.583912,-90.556389
"Holy Martyrs of Japan, Church of the (Japan)",https://www.archstl.org/parish-directory/holy-martyrs-of-japan-church-of-the-japan,573.627.3378,"8244 Highway AE, Sullivan, MO 63080-3229",38.2081,-91.16042
Holy Name of Jesus (Bissell Hills),https://www.archstl.org/parish-directory/holy-name-of-jesus-bissell-hills,314.868.2310,"10235 Ashbrook Dr., St. Louis, MO 63137-1598",38.75624,-90.231461
Holy Redeemer (Webster Groves),https://www.archstl.org/parish-directory/holy-redeemer-webster-groves,314.962.0038,"17 Joy Ave., St. Louis, MO 63119-2599",38.59223,-90.348084
Holy Rosary (Warrenton),https://www.archstl.org/parish-directory/holy-rosary-warrenton,636.456.3698,"724 E. Booneslick Rd., Warrenton, MO 63383-2216",38.812041,-91.136147
Holy Spirit (Maryland Heights),https://www.archstl.org/parish-directory/holy-spirit-maryland-heights,314.739.0230,"3130 Parkwood Ln., Maryland Heights, MO 63043-1396",38.734543,-90.432349
Immacolata (Richmond Heights),https://www.archstl.org/parish-directory/immacolata-richmond-heights,314.991.5700,"8900 Clayton Rd., St. Louis, MO 63117-1093",38.638178,-90.350611
Immaculate Conception (Arnold),https://www.archstl.org/parish-directory/immaculate-conception-arnold,636.321.0002,"2300 Church Rd., Arnold, MO 63010-2110",38.434706,-90.379596
Immaculate Conception (Augusta),https://www.archstl.org/parish-directory/immaculate-conception-augusta,636.482.4455,"5912 S. Highway 94, Augusta, MO 63332-1604",38.582619,-90.900789
Immaculate Conception (Dardenne Prairie),https://www.archstl.org/parish-directory/immaculate-conception-dardenne-prairie,636.561.6611,"7701 Town Square Ave., Dardenne Prairie, MO 63368-6702",38.7695,-90.72902
Immaculate Conception (Maplewood),https://www.archstl.org/parish-directory/immaculate-conception-maplewood,314.645.3307,"2934 Marshall Ave., St. Louis, MO 63143-3299",38.61121,-90.316138
Immaculate Conception (Old Monroe),https://www.archstl.org/parish-directory/immaculate-conception-old-monroe,636.661.5002,"110 Maryknoll Rd., Old Monroe, MO 63369-2329",38.936739,-90.779472
Immaculate Conception (Park Hills),https://www.archstl.org/parish-directory/immaculate-conception-park-hills,573.431.2427,"1020 W. Main St., P.O. Box 66, Park Hills, MO 63601-0066",37.861223,-90.532551
Immaculate Conception (Union),https://www.archstl.org/parish-directory/immaculate-conception-union,636.583.5144,"100 N. Washington Ave., Union, MO 63084-1692",38.446366,-91.008479
Immaculate Heart of Mary (New Melle),https://www.archstl.org/parish-directory/immaculate-heart-of-mary-new-melle,636.398.5270,"8 W. Highway D, P.O. Box 100, New Melle, MO 63365-0100",38.716287,-90.875127
Immaculate Heart of Mary (St. Louis),https://www.archstl.org/parish-directory/immaculate-heart-of-mary-st-louis,314.481.7543,"4092 Blow St., St. Louis, MO 63116-2796",38.562549,-90.276291
Incarnate Word (Chesterfield),https://www.archstl.org/parish-directory/incarnate-word-chesterfield,314.576.5366,"13416 Olive Blvd., Chesterfield, MO 63017-3196",38.679804,-90.496767
Little Flower (Richmond Heights),https://www.archstl.org/parish-directory/little-flower-richmond-heights,314.645.1445,"1264 Arch Ter., St. Louis, MO 63117-1491",38.630434,-90.328067
"Mary, Mother of the Church (Mattese)",https://www.archstl.org/parish-directory/mary-mother-of-the-church-mattese,314.894.1373,"5901 Kerth Rd., St. Louis, MO 63128-3705",38.471075,-90.374483
"Mary, Queen of Peace (Webster Groves)",https://www.archstl.org/parish-directory/mary-queen-of-peace-webster-groves,314.962.2311,"676 W. Lockwood Ave., St. Louis, MO 63119-3597",38.584076,-90.375326
Most Holy Trinity (St. Louis),https://www.archstl.org/parish-directory/most-holy-trinity-st-louis,314.241.9165,"3519 N. Fourteenth St., St. Louis, MO 63107-3796",38.66535,-90.212561
Most Sacred Heart (Eureka),https://www.archstl.org/parish-directory/most-sacred-heart-eureka,636.938.5048,"350 E. Fourth St., Eureka, MO 63025-1949",38.505138,-90.620232
Old St. Ferdinand Shrine,https://www.archstl.org/parish-directory/old-st-ferdinand-shrine,,"1 Rue St. Francois, Florissant, MO 63031-6815",38.796493,-90.334289
Oratory of Sts. Gregory and Augustine (Richmond Heights),https://www.archstl.org/parish-directory/oratory-of-sts-gregory-and-augustine-richmond-heights,314.925.8989,"7230 Dale Avenue, St. Louis, MO 63117-2398",38.626988,-90.311871
Our Lady (Festus),https://www.archstl.org/parish-directory/our-lady-festus,636.931.4702,"1550 St. Marys Ln., Festus, MO 63028-1543",38.226603,-90.418947
Our Lady Help of Christians (Weingarten),https://www.archstl.org/parish-directory/our-lady-help-of-christians-weingarten,573.883.3796,"13370 Highway 32, Ste. Genevieve, MO 63670-8304",37.927289,-90.110286
Our Lady of Guadalupe (Ferguson),https://www.archstl.org/parish-directory/our-lady-of-guadalupe-ferguson,314.522.9264,"1115 S. Florissant Rd., St. Louis, MO 63121-1198",38.730097,-90.302788
Our Lady of Lourdes (University City),https://www.archstl.org/parish-directory/our-lady-of-lourdes-university-city,314.726.6200,"7148 Forsyth Blvd., St. Louis, MO 63105-2199",38.64749,-90.32086
Our Lady of Lourdes (Washington),https://www.archstl.org/parish-directory/our-lady-of-lourdes-washington,636.239.3520,"1014 Madison Ave., Washington, MO 63090-4898",38.544684,-91.003102
Our Lady of Providence (Crestwood),https://www.archstl.org/parish-directory/our-lady-of-providence-crestwood,314.843.3570,"8866 Pardee Rd., St. Louis, MO 63123-1096",38.559647,-90.358605
Our Lady of Sorrows (St. Louis),https://www.archstl.org/parish-directory/our-lady-of-sorrows-st-louis,314.351.1600,"5020 Rhodes Ave., St. Louis, MO 63109-3589",38.577717,-90.284125
Our Lady of the Holy Cross (St. Louis),https://www.archstl.org/parish-directory/our-lady-of-the-holy-cross-st-louis,314.381.0323,"8115 Church Rd., St. Louis, MO 63147-1832",38.710609,-90.232926
Our Lady of the Pillar (St. Louis),https://www.archstl.org/parish-directory/our-lady-of-the-pillar-st-louis,314.993.2280,"401 S. Lindbergh Blvd., St. Louis, MO 63131-2729",38.651194,-90.405388
Our Lady of the Presentation (Overland),https://www.archstl.org/parish-directory/our-lady-of-the-presentation-overland,314.427.0486,"8860 Tudor Ave., St. Louis, MO 63114-4998",38.70889,-90.350759
Our Lady of Victory (Sereno),https://www.archstl.org/parish-directory/our-lady-of-victory-sereno,573.547.4300,"172 PCR 920, Perryville, MO 63775-8368",37.797838,-89.851391
"Our Lady, Queen of Peace (House Springs)",https://www.archstl.org/parish-directory/our-lady-queen-of-peace-house-springs,636.671.3062,"4696 Notre Dame Ln., House Springs, MO 63051-2045",38.405868,-90.589091
Queen of All Saints (Oakville),https://www.archstl.org/parish-directory/queen-of-all-saints-oakville,314.846.8207,"6603 Christopher Dr., St. Louis, MO 63129-4919",38.443758,-90.308946
Resurrection of Our Lord (St. Louis),https://www.archstl.org/parish-directory/resurrection-of-our-lord-st-louis,314.832.7023,"3900 Meramec St., St. Louis, MO 63116-4499",38.584273,-90.251722
Sacred Heart (Crystal City),https://www.archstl.org/parish-directory/sacred-heart-crystal-city,636.937.4662,"555 Bailey Rd., Crystal City, MO 63019-1798",38.219947,-90.387971
Sacred Heart (Elsberry),https://www.archstl.org/parish-directory/sacred-heart-elsberry,573.898.2202,"714 Lincoln St., Elsberry, MO 63343-1125",39.164687,-90.789236
Sacred Heart (Florissant),https://www.archstl.org/parish-directory/sacred-heart-florissant,314.837.3757,"751 N. Jefferson St., Florissant, MO 63031-5085",38.794831,-90.325991
Sacred Heart (Ozora),https://www.archstl.org/parish-directory/sacred-heart-ozora,573.543.2209,"17742 State Rte. N, St. Mary, MO 63673-9035",37.867563,-90.32632
Sacred Heart (Troy),https://www.archstl.org/parish-directory/sacred-heart-troy,636.528.8219,"100 Thompson Dr., Troy, MO 63379-2321",38.978305,-90.962194
Sacred Heart (Valley Park),https://www.archstl.org/parish-directory/sacred-heart-valley-park,636.225.5268,"17 Ann Ave., Valley Park, MO 63088-1696",38.552166,-90.49187
Seven Holy Founders (Affton),https://www.archstl.org/parish-directory/seven-holy-founders-affton,314.638.3938,"6741 S. Rockhill Rd., St. Louis, MO 63123-3198",38.547552,-90.324115
St. Agatha (St. Louis),https://www.archstl.org/parish-directory/st-agatha-st-louis,314.772.1603,"3239 S. Ninth St., St. Louis, MO 63118-2697",38.594394,-90.214699
St. Agnes (Bloomsdale),https://www.archstl.org/parish-directory/st-agnes-bloomsdale,573.483.2555,"40 St. Agnes Dr., P.O. Box 124, Bloomsdale, MO 63627-0124",38.023217,-90.252806
St. Alban Roe (Wildwood),https://www.archstl.org/parish-directory/st-alban-roe-wildwood,636.458.2977,"2001 Shepard Rd., Wildwood, MO 63038-1360",38.597168,-90.643009
St. Alphonsus (Millwood),https://www.archstl.org/parish-directory/st-alphonsus-millwood,573.384.6223,"29 St. Alphonsus Rd., Silex, MO 63377-3217",39.10465,-91.106228
St. Alphonsus Liguori (Rock) (St. Louis),https://www.archstl.org/parish-directory/st-alphonsus-liguori-rock-st-louis,314.533.0304,"1118 N. Grand Blvd., St. Louis, MO 63106-1696",38.643856,-90.227572
St. Ambrose (St. Louis),https://www.archstl.org/parish-directory/st-ambrose-st-louis,314.771.1228,"5130 Wilson Ave., St. Louis, MO 63110-3110",38.615308,-90.27198
St. Andrew (Lemay),https://www.archstl.org/parish-directory/st-andrew-lemay,314.631.0691,"309 Hoffmeister Ave., St. Louis, MO 63125-1609",38.534375,-90.276226
St. Andrew Kim (University City),https://www.archstl.org/parish-directory/st-andrew-kim-university-city,314.993.1277,"8665 Olive Blvd., St. Louis, MO 63132-2586",38.675503,-90.35901
St. Angela Merici (Florissant),https://www.archstl.org/parish-directory/st-angela-merici-florissant,314.838.6565,"3860 N. Highway 67, Florissant, MO 63034-2427",38.814172,-90.285255
St. Ann (Clover Bottom),https://www.archstl.org/parish-directory/st-ann-clover-bottom,636.239.3222,"7851 Highway YY, Washington, MO 63090-4050",38.491163,-91.043651
St. Ann (Normandy),https://www.archstl.org/parish-directory/st-ann-normandy,314.385.5090,"7530 Natural Bridge Rd., St. Louis, MO 63121-4993",38.704678,-90.300477
St. Anne (French Village),https://www.archstl.org/parish-directory/st-anne-french-village,573.358.2112,"C/O 15 St. Joseph St., Bonne Terre, MO 63628-1294",37.928464,-90.496173
St. Anselm (Creve Coeur),https://www.archstl.org/parish-directory/st-anselm-creve-coeur,314.878.2120,"530 S. Mason Rd., St. Louis, MO 63141-8522",38.642837,-90.478668
St. Anthony (Sullivan),https://www.archstl.org/parish-directory/st-anthony-sullivan,573.468.6101,"201 W. Springfield Rd., Sullivan, MO 63080-1550",38.213463,-91.164013
St. Anthony of Padua (High Ridge),https://www.archstl.org/parish-directory/st-anthony-of-padua-high-ridge,636.677.4868,"3009 High Ridge Blvd., High Ridge, MO 63049-2216",38.458171,-90.536179
St. Anthony of Padua (St. Louis),https://www.archstl.org/parish-directory/st-anthony-of-padua-st-louis,314.353.7470,"3140 Meramec St., St. Louis, MO 63118-4399",38.579537,-90.239541
St. Augustine (St. Louis),https://www.archstl.org/parish-directory/st-augustine-st-louis,314.385.1934,"1371 Hamilton Ave., St. Louis, MO 63112-3751",38.670334,-90.285287
St. Barnabas (OFallon),https://www.archstl.org/parish-directory/st-barnabas-ofallon,636.240.4556,"1400 N. Main St., O'Fallon, MO 63366-4321",38.830431,-90.699064
St. Bernadette (Lemay),https://www.archstl.org/parish-directory/st-bernadette-lemay,314.892.6882,"68 Sherman Rd., St. Louis, MO 63125-4125",38.505225,-90.285593
St. Bridget of Kildare (Pacific),https://www.archstl.org/parish-directory/st-bridget-of-kildare-pacific,636.271.3993,"111 W. Union St., Pacific, MO 63069-1414",38.483232,-90.741521
St. Catherine Laboure (Sappington),https://www.archstl.org/parish-directory/st-catherine-laboure-sappington,314.843.3245,"9740 Sappington Rd., St. Louis, MO 63128-1293",38.527591,-90.37948
St. Catherine of Alexandria (Coffman),https://www.archstl.org/parish-directory/st-catherine-of-alexandria-coffman,573.756.4250,"23496 State Route WW, Ste. Genevieve, MO 63670-3132",37.780241,-90.194393
St. Cecilia (St. Louis),https://www.archstl.org/parish-directory/st-cecilia-st-louis,314.351.1318,"5418 Louisiana Ave., St. Louis, MO 63111-1897",38.568744,-90.250406
St. Charles Borromeo (St. Charles),https://www.archstl.org/parish-directory/st-charles-borromeo-st-charles,636.946.1893,"601 N. Fourth St., St. Charles, MO 63301-2093",38.787257,-90.482543
St. Clare (St. Clair),https://www.archstl.org/parish-directory/st-clare-st-clair,636.629.0315,"165 E. Springfield Rd., St. Clair, MO 63077-1727",38.34245,-90.985472
St. Clare of Assisi (Ellisville),https://www.archstl.org/parish-directory/st-clare-of-assisi-ellisville,636.394.7307,"15642 Clayton Rd., Ellisville, MO 63011-2398",38.605756,-90.572748
St. Clement of Rome (Des Peres),https://www.archstl.org/parish-directory/st-clement-of-rome-des-peres,314.965.0709,"1510 Bopp Rd., St. Louis, MO 63131-4137",38.608835,-90.433298
St. Cletus (St. Charles),https://www.archstl.org/parish-directory/st-cletus-st-charles,636.946.6327,"2705 Zumbehl Rd., St. Charles, MO 63301-1135",38.801202,-90.535871
St. Cronan (St. Louis),https://www.archstl.org/parish-directory/st-cronan-st-louis,314.289.9384,"1202 S. Boyle Ave., St. Louis, MO 63110-3894",38.626465,-90.253842
St. David (Arnold),https://www.archstl.org/parish-directory/st-david-arnold,636.296.5485,"2334 Tenbrook Rd., Arnold, MO 63010-2366",38.442099,-90.362484
St. Elizabeth Ann Seton (St. Charles),https://www.archstl.org/parish-directory/st-elizabeth-ann-seton-st-charles,636.946.6717,"2 Seton Ct., St. Charles, MO 63303-3362",38.777464,-90.541827
St. Elizabeth of Hungary (Crestwood),https://www.archstl.org/parish-directory/st-elizabeth-of-hungary-crestwood,314.968.0760,"1420 S. Sappington Rd., St. Louis, MO 63126-1699",38.560996,-90.384634
"St. Elizabeth, Mother of John the Baptist (St. Louis)",https://www.archstl.org/parish-directory/st-elizabeth-mother-of-john-the-baptist-st-louis,314.381.4145,"4330 Shreve Ave., St. Louis, MO 63115-2199",38.681106,-90.239634
St. Ferdinand (Florissant),https://www.archstl.org/parish-directory/st-ferdinand-florissant,314.837.3165,"1765 Charbonier Rd., Florissant, MO 63031-5497",38.807005,-90.354651
St. Francis Borgia (Washington),https://www.archstl.org/parish-directory/st-francis-borgia-washington,636.239.6701,"115 Cedar St., Washington, MO 63090-2193",38.5607,-91.014759
St. Francis De Sales Oratory (St. Louis),https://www.archstl.org/parish-directory/st-francis-de-sales-oratory-st-louis,314.771.3100,"2653 Ohio Ave., St. Louis, MO 63118-1594",38.604356,-90.226099
St. Francis of Assisi (Luebbering),https://www.archstl.org/parish-directory/st-francis-of-assisi-luebbering,636.629.1717,"1000 Luebbering Rd., Luebbering, MO 63061-3100",38.26946,-90.823168
St. Francis of Assisi (Oakville),https://www.archstl.org/parish-directory/st-francis-of-assisi-oakville,314.487.5736,"4556 Telegraph Rd., St. Louis, MO 63129-3397",38.479564,-90.303991
St. Francis of Assisi (Portage des Sioux),https://www.archstl.org/parish-directory/st-francis-of-assisi-portage-des-sioux,314.482.6084,"1355 Farnham St., Portage Des Sioux, MO 63373-0129",38.925905,-90.344522
St. Francis Xavier (College Church) (St. Louis),https://www.archstl.org/parish-directory/st-francis-xavier-college-church-st-louis,314.977.7300,"3628 Lindell Blvd., St. Louis, MO 63108-3394",38.637208,-90.234759
St. Gabriel the Archangel (St. Louis),https://www.archstl.org/parish-directory/st-gabriel-the-archangel-st-louis,314.353.6303,"6303 Nottingham Ave., St. Louis, MO 63109-3177",38.587797,-90.299254
St. Gerald,https://www.archstl.org/parish-directory/st-gerald,573.459.6441,"c/o 124 Holy Family Church Rd., New Haven, MO 63068",38.558487,-91.247283
St. Gerard Majella (Kirkwood),https://www.archstl.org/parish-directory/st-gerard-majella-kirkwood,314.965.3985,"1969 Dougherty Ferry Rd., St. Louis, MO 63122-3538",38.585774,-90.440572
St. Gertrude (Krakow),https://www.archstl.org/parish-directory/st-gertrude-krakow,636.239.4216,"6535 Highway YY, Washington, MO 63090-4074",38.491163,-91.043651
St. Gianna (Wentzville),https://www.archstl.org/parish-directory/st-gianna-wentzville,636.327.3639,"450 E. Highway N, Wentzville, MO 63385-5905",38.79067,-90.852228
St. Ignatius Loyola (Concord Hill),https://www.archstl.org/parish-directory/st-ignatius-loyola-concord-hill,636.932.4445,"19127 Mill Rd., Marthasville, MO 63357-3096",38.649403,-91.139568
St. James (Catawissa),https://www.archstl.org/parish-directory/st-james-catawissa,636.451.4685,"1107 Summit Dr., Catawissa, MO 63015-1404",38.427185,-90.785161
St. James (Crosstown),https://www.archstl.org/parish-directory/st-james-crosstown,573.547.4300,"Administered from St. Vincent de Paul (Perryville), C/O 1010 Rosati Ct.",42.108585,-72.20448
St. James (Potosi),https://www.archstl.org/parish-directory/st-james-potosi,573.438.4686,"201 N. Missouri Ave., Potosi, MO 63664-1745",37.936894,-90.787061
St. James the Greater (St. Louis),https://www.archstl.org/parish-directory/st-james-the-greater-st-louis,314.645.0167,"6401 Wade Ave., St. Louis, MO 63139-3497",38.625759,-90.293771
St. Joachim (Old Mines),https://www.archstl.org/parish-directory/st-joachim-old-mines,573.438.6181,"10120 Crest Rd., Cadet, MO 63630-9629",38.018265,-90.728895
St. Joan of Arc (St. Louis),https://www.archstl.org/parish-directory/st-joan-of-arc-st-louis,314.832.2838,"5800 Oleatha Ave., St. Louis, MO 63139-1979",38.597208,-90.291574
St. John Bosco (Creve Coeur),https://www.archstl.org/parish-directory/st-john-bosco-creve-coeur,314.434.1312,"12934 Marine Ave., St. Louis, MO 63146-2234",38.706998,-90.473909
St. John Nepomuk Chapel (St. Louis),https://www.archstl.org/parish-directory/st-john-nepomuk-chapel-st-louis,314.231.0141,"1625 S. Eleventh St., St. Louis, MO 63104-3705",38.611401,-90.214461
St. John Paul II (Affton),https://www.archstl.org/parish-directory/st-john-paul-ii-affton,314.353.7629,"4980 Heege Road, St. Louis, MO 63123-4791",38.558633,-90.302443
St. John the Apostle (Bismarck),https://www.archstl.org/parish-directory/st-john-the-apostle-bismarck,573.431.2427,"P.O. Box 66, Park Hills, MO 63601-0066",37.849808,-90.488486
St. John the Baptist (Gildehaus),https://www.archstl.org/parish-directory/st-john-the-baptist-gildehaus,636.583.2488,"5567 Gildehaus Rd., Villa Ridge, MO 63089-1228",38.484507,-90.939766
St. John the Baptist (St. Louis),https://www.archstl.org/parish-directory/st-john-the-baptist-st-louis,314.353.1255,"4200 Delor St., St. Louis, MO 63116-2388",38.579689,-90.26436
St. John the Beloved Disciple (Imperial),https://www.archstl.org/parish-directory/st-john-the-beloved-disciple-imperial,636.296.8061,"4614 Blue Springs Dr., Imperial, MO 63052-1237",38.414862,-90.493008
"St. John, Apostle and Evangelist (St. Louis)",https://www.archstl.org/parish-directory/st-john-apostle-and-evangelist-st-louis,314.421.3467,"15 Plaza Sq., St. Louis, MO 63103-2395",38.629662,-90.203109
St. Joseph (Apple Creek),https://www.archstl.org/parish-directory/st-joseph-apple-creek,573.788.2330,"138 St. Joseph Ln., Perryville, MO 63775-6242",37.612862,-89.751373
St. Joseph (Bonne Terre),https://www.archstl.org/parish-directory/st-joseph-bonne-terre,573.358.2112,"15 St. Joseph St., Bonne Terre, MO 63628-1294",37.924268,-90.554261
St. Joseph (Clayton),https://www.archstl.org/parish-directory/st-joseph-clayton,314.726.1221,"106 N. Meramec Ave., St. Louis, MO 63105-3788",38.652009,-90.339159
St. Joseph (Cottleville),https://www.archstl.org/parish-directory/st-joseph-cottleville,636.441.0055,"1355 Motherhead Rd., St. Charles, MO 63304-7686",38.7433,-90.652732
St. Joseph (Farmington),https://www.archstl.org/parish-directory/st-joseph-farmington,573.756.4250,"10 N. Long St., Farmington, MO 63640-3132",37.77997,-90.415301
St. Joseph (Highland),https://www.archstl.org/parish-directory/st-joseph-highland,573.547.4300,"C/O 1010 Rosati Ct., Perryville, MO 63775-2319",37.727156,-89.862749
St. Joseph (Imperial),https://www.archstl.org/parish-directory/st-joseph-imperial,636.464.1013,"6020 Old Antonia Rd., Imperial, MO 63052-2394",38.368533,-90.389809
St. Joseph (Josephville),https://www.archstl.org/parish-directory/st-joseph-josephville,636.332.6676,"1390 Josephville Rd., Wentzville, MO 63385-3008",38.843135,-90.796002
St. Joseph (Manchester),https://www.archstl.org/parish-directory/st-joseph-manchester,636.227.5247,"567 St. Joseph Ln., Manchester, MO 63021-5393",38.587188,-90.517753
St. Joseph (Neier),https://www.archstl.org/parish-directory/st-joseph-neier,636.583.2806,"2401 Neier Rd., Union, MO 63084-3411",38.389989,-91.109409
St. Joseph (Tiff),https://www.archstl.org/parish-directory/st-joseph-tiff,573.438.6181,"C/O 10120 Crest Rd., Cadet, MO 63630-9717",38.018265,-90.728895
St. Joseph (Zell),https://www.archstl.org/parish-directory/st-joseph-zell,573.883.3481,"11824 Zell Rd., Ste. Genevieve, MO 63670-8025",37.950741,-90.146349
"St. Joseph, Shrine of (St. Louis)",https://www.archstl.org/parish-directory/st-joseph-shrine-of-st-louis,314.231.9407,"1220 N. Eleventh St., St. Louis, MO 63106-4614",38.644501,-90.208361
St. Joseph-Croatian (St. Louis),https://www.archstl.org/parish-directory/st-joseph-croatian-st-louis,314.771.0958,"2112 S. Twelfth St., St. Louis, MO 63104-4129",38.611401,-90.214461
St. Jude (Overland),https://www.archstl.org/parish-directory/st-jude-overland,314.428.2262,"2218 N. Warson Rd., St. Louis, MO 63114-2025",38.698395,-90.39949
St. Justin Martyr (Sunset Hills),https://www.archstl.org/parish-directory/st-justin-martyr-sunset-hills,314.843.8482,"11910 Eddie and Park Rd., St. Louis, MO 63126-2908",38.543896,-90.39076
St. Lawrence (Lawrenceton),https://www.archstl.org/parish-directory/st-lawrence-lawrenceton,573.483.2555,"C/O 40 St. Agnes Dr., P.O. Box 124",37.9651321,-90.305025
St. Louis Byzantine (Ruthenian) Church Byzantine Eparchy of Parma,https://www.archstl.org/parish-directory/st-louis-byzantine-ruthenian-church-byzantine-eparchy-of-parma,314.434.4211,"320 E. Ripa Ave., St. Louis, MO 63123",38.52362,-90.271898
St. Luke the Evangelist (Richmond Heights),https://www.archstl.org/parish-directory/st-luke-the-evangelist-richmond-heights,314.644.2144,"7230 Dale Ave., St. Louis, MO 63117-2398",38.626988,-90.311871
St. Margaret Mary Alacoque (Mehlville),https://www.archstl.org/parish-directory/st-margaret-mary-alacoque-mehlville,314.487.2522,"4900 Ringer Rd., St. Louis, MO 63129-1797",38.486291,-90.329693
